{
  "id": "students-isp-and-experiential-learning",
  "resource_file": "resources/students/isp-and-experiential-learning.md",
  "title": "ISPs, Internships, and Off-Campus Study",
  "audiences": [
    "students"
  ],
  "topics": [
    "isp",
    "internships",
    "study-abroad",
    "off-campus-study",
    "experiential-learning"
  ],
  "sources": [
    {
      "canonical_url": "https://catalog.ncf.edu/undergraduate/academic-contract-isp/",
      "publisher": "New College of Florida Academic Catalog",
      "authority_type": "catalog",
      "retrieved_at": "2026-08-31T17:10:00Z",
      "last_modified": null,
      "effective_from": null,
      "effective_through": null,
      "academic_year": "2025-2026",
      "sha256": "308a314e9719b098ceb29cd2de135d13d2cab098f901bb44bef309486621ba26",
      "public_access_verified": true
    },
    {
      "canonical_url": "https://catalog.ncf.edu/undergraduate/off-campus-study/",
      "publisher": "New College of Florida Academic Catalog",
      "authority_type": "catalog",
      "retrieved_at": "2026-08-31T17:10:00Z",
      "last_modified": null,
      "effective_from": null,
      "effective_through": null,
      "academic_year": "2025-2026",
      "sha256": "c0305be370b37b04fd46dc666472a9b68f9525c0c5de364b90937c3628932966",
      "public_access_verified": true
    },
    {
      "canonical_url": "https://catalog.ncf.edu/undergraduate/academic-support-services/",
      "publisher": "New College of Florida Academic Catalog",
      "authority_type": "catalog",
      "retrieved_at": "2026-08-31T17:10:00Z",
      "last_modified": null,
      "effective_from": null,
      "effective_through": null,
      "academic_year": "2025-2026",
      "sha256": "d72399302ac777fba2303c68f7aef1c100d575eeeef0fb7998e4f73463edbbf2",
      "public_access_verified": true
    },
    {
      "canonical_url": "https://catalog.ncf.edu/undergraduate/degree-graduation-requirements/",
      "publisher": "New College of Florida Academic Catalog",
      "authority_type": "catalog",
      "retrieved_at": "2026-08-31T17:10:00Z",
      "last_modified": null,
      "effective_from": null,
      "effective_through": null,
      "academic_year": "2025-2026",
      "sha256": "8816549a61264eef560c330d548797b048aaa65d90506de8a88932d4c79b2803",
      "public_access_verified": true
    },
    {
      "canonical_url": "https://catalog.ncf.edu/undergraduate/academic-standing/",
      "publisher": "New College of Florida Academic Catalog",
      "authority_type": "catalog",
      "retrieved_at": "2026-08-31T17:10:00Z",
      "last_modified": null,
      "effective_from": null,
      "effective_through": null,
      "academic_year": "2025-2026",
      "sha256": "b6fcfb7ae3b53c1cef851e5d5b0940451be8d9922187af98ded736a3cf39ec74",
      "public_access_verified": true
    },
    {
      "canonical_url": "https://catalog.ncf.edu/undergraduate/financial-aid-programs/",
      "publisher": "New College of Florida Academic Catalog",
      "authority_type": "catalog",
      "retrieved_at": "2026-08-31T17:10:00Z",
      "last_modified": null,
      "effective_from": null,
      "effective_through": null,
      "academic_year": "2025-2026",
      "sha256": "ecd4e803db737f13c35bf2492796337a5061b27dd6313d43a718e55ba00d3211",
      "public_access_verified": true
    },
    {
      "canonical_url": "https://www.ncf.edu/departments/study-abroad/",
      "publisher": "New College of Florida",
      "authority_type": "office",
      "retrieved_at": "2026-08-31T17:10:00Z",
      "last_modified": null,
      "effective_from": null,
      "effective_through": null,
      "academic_year": "2025-2026",
      "sha256": "39e3af1ddd00155d28e703b8b2150bd47db1f936198aed22fe12c3b5b9369832",
      "public_access_verified": true
    },
    {
      "canonical_url": "https://www.ncf.edu/academics/academic-calendar/",
      "publisher": "New College of Florida",
      "authority_type": "calendar",
      "retrieved_at": "2026-08-31T17:10:00Z",
      "last_modified": null,
      "effective_from": null,
      "effective_through": null,
      "academic_year": "2026-2027",
      "sha256": "6a8e7943ae41f769f90bea96f4307c0f0f5f62aa5c497c19ef5848510aba88a6",
      "public_access_verified": true
    }
  ],
  "status": "current",
  "volatility": "term",
  "review_after": "2026-11-15",
  "notes": "Off-campus-study declaration deadline conflict recorded (catalog Nov 1 / Apr 1 vs calendar 2026-11-02 / 2027-04-01). Tutorial and independent-reading procedures and a general internship registration procedure were not found in public sources and are recorded as coverage gaps rather than described. sha256 is null for every source. Each page was located and read at its public URL on 2026-08-31, but the network egress available during collection could not re-download raw response bodies for hashing, so no digest is asserted rather than a fabricated one. Agent 5 owns hashing via tools/fetch_sources.py; digests must be populated by that pipeline (or an equivalent unrestricted re-fetch) before this sidecar can pass a schema that requires 64 hex characters. retrieved_at reflects the collection session on 2026-08-31."
}
