{
  "id": "students-degree-planning",
  "resource_file": "resources/students/degree-planning.md",
  "title": "Degree Planning and Graduation Requirements",
  "audiences": [
    "students"
  ],
  "topics": [
    "graduation",
    "general-education",
    "area-of-concentration",
    "thesis",
    "baccalaureate-exam",
    "transfer-credit",
    "graduate-programs",
    "catalog-year"
  ],
  "sources": [
    {
      "canonical_url": "https://catalog.ncf.edu/undergraduate/degree-graduation-requirements/",
      "publisher": "New College of Florida Academic Catalog",
      "authority_type": "catalog",
      "retrieved_at": "2026-08-31T17:10:00Z",
      "last_modified": null,
      "effective_from": null,
      "effective_through": null,
      "academic_year": "2025-2026",
      "sha256": null,
      "public_access_verified": true
    },
    {
      "canonical_url": "https://catalog.ncf.edu/undergraduate/general-education/",
      "publisher": "New College of Florida Academic Catalog",
      "authority_type": "catalog",
      "retrieved_at": "2026-08-31T17:10:00Z",
      "last_modified": null,
      "effective_from": null,
      "effective_through": null,
      "academic_year": "2025-2026",
      "sha256": null,
      "public_access_verified": true
    },
    {
      "canonical_url": "https://catalog.ncf.edu/undergraduate/area-of-concentration/",
      "publisher": "New College of Florida Academic Catalog",
      "authority_type": "catalog",
      "retrieved_at": "2026-08-31T17:10:00Z",
      "last_modified": null,
      "effective_from": null,
      "effective_through": null,
      "academic_year": "2025-2026",
      "sha256": null,
      "public_access_verified": true
    },
    {
      "canonical_url": "https://catalog.ncf.edu/undergraduate/minors-certificates/",
      "publisher": "New College of Florida Academic Catalog",
      "authority_type": "catalog",
      "retrieved_at": "2026-08-31T17:10:00Z",
      "last_modified": null,
      "effective_from": null,
      "effective_through": null,
      "academic_year": "2025-2026",
      "sha256": null,
      "public_access_verified": true
    },
    {
      "canonical_url": "https://catalog.ncf.edu/undergraduate/senior-project-thesis/",
      "publisher": "New College of Florida Academic Catalog",
      "authority_type": "catalog",
      "retrieved_at": "2026-08-31T17:10:00Z",
      "last_modified": null,
      "effective_from": null,
      "effective_through": null,
      "academic_year": "2025-2026",
      "sha256": null,
      "public_access_verified": true
    },
    {
      "canonical_url": "https://catalog.ncf.edu/undergraduate/baccalaureate-exam/",
      "publisher": "New College of Florida Academic Catalog",
      "authority_type": "catalog",
      "retrieved_at": "2026-08-31T17:10:00Z",
      "last_modified": null,
      "effective_from": null,
      "effective_through": null,
      "academic_year": "2025-2026",
      "sha256": null,
      "public_access_verified": true
    },
    {
      "canonical_url": "https://catalog.ncf.edu/undergraduate/transfer-policy/",
      "publisher": "New College of Florida Academic Catalog",
      "authority_type": "catalog",
      "retrieved_at": "2026-08-31T17:10:00Z",
      "last_modified": null,
      "effective_from": null,
      "effective_through": null,
      "academic_year": "2025-2026",
      "sha256": null,
      "public_access_verified": true
    },
    {
      "canonical_url": "https://catalog.ncf.edu/undergraduate/academic-contract-isp/",
      "publisher": "New College of Florida Academic Catalog",
      "authority_type": "catalog",
      "retrieved_at": "2026-08-31T17:10:00Z",
      "last_modified": null,
      "effective_from": null,
      "effective_through": null,
      "academic_year": "2025-2026",
      "sha256": null,
      "public_access_verified": true
    },
    {
      "canonical_url": "https://catalog.ncf.edu/graduate/master-applied-data-science/",
      "publisher": "New College of Florida Academic Catalog",
      "authority_type": "catalog",
      "retrieved_at": "2026-08-31T17:10:00Z",
      "last_modified": null,
      "effective_from": null,
      "effective_through": null,
      "academic_year": "2025-2026",
      "sha256": null,
      "public_access_verified": true
    },
    {
      "canonical_url": "https://catalog.ncf.edu/graduate/",
      "publisher": "New College of Florida Academic Catalog",
      "authority_type": "catalog",
      "retrieved_at": "2026-08-31T17:10:00Z",
      "last_modified": null,
      "effective_from": null,
      "effective_through": null,
      "academic_year": "2025-2026",
      "sha256": null,
      "public_access_verified": true
    },
    {
      "canonical_url": "https://www.ncf.edu/academics/academic-calendar/",
      "publisher": "New College of Florida",
      "authority_type": "calendar",
      "retrieved_at": "2026-08-31T17:10:00Z",
      "last_modified": null,
      "effective_from": null,
      "effective_through": null,
      "academic_year": "2026-2027",
      "sha256": null,
      "public_access_verified": true
    }
  ],
  "status": "current",
  "volatility": "annual",
  "review_after": "2027-06-30",
  "notes": "Two unresolved conflicts are documented: (1) the general education page states 36 credit hours while its itemized components as published appear to total 38; (2) the catalog anchors PAOC and thesis-prospectus milestones to contract number while the academic calendar anchors them to semester number with different dates. Neither is reconciled. No B.A. residency-unit figure is published, so none is asserted. sha256 is null for every source. Each page was located and read at its public URL on 2026-08-31, but the network egress available during collection could not re-download raw response bodies for hashing, so no digest is asserted rather than a fabricated one. Agent 5 owns hashing via tools/fetch_sources.py; digests must be populated by that pipeline (or an equivalent unrestricted re-fetch) before this sidecar can pass a schema that requires 64 hex characters. retrieved_at reflects the collection session on 2026-08-31."
}
