{
  "id": "students-academic-model",
  "resource_file": "resources/students/academic-model.md",
  "title": "The New College Academic Model",
  "audiences": [
    "students"
  ],
  "topics": [
    "contracts",
    "units-credits",
    "evaluation",
    "academic-standing",
    "advising",
    "grading"
  ],
  "sources": [
    {
      "canonical_url": "https://catalog.ncf.edu/undergraduate/academic-contract-isp/",
      "publisher": "New College of Florida Academic Catalog",
      "authority_type": "catalog",
      "retrieved_at": "2026-08-31T17:10:00Z",
      "last_modified": null,
      "effective_from": null,
      "effective_through": null,
      "academic_year": "2025-2026",
      "sha256": null,
      "public_access_verified": true
    },
    {
      "canonical_url": "https://catalog.ncf.edu/undergraduate/registration/",
      "publisher": "New College of Florida Academic Catalog",
      "authority_type": "catalog",
      "retrieved_at": "2026-08-31T17:10:00Z",
      "last_modified": null,
      "effective_from": null,
      "effective_through": null,
      "academic_year": "2025-2026",
      "sha256": null,
      "public_access_verified": true
    },
    {
      "canonical_url": "https://catalog.ncf.edu/undergraduate/grading-policy/",
      "publisher": "New College of Florida Academic Catalog",
      "authority_type": "catalog",
      "retrieved_at": "2026-08-31T17:10:00Z",
      "last_modified": null,
      "effective_from": null,
      "effective_through": null,
      "academic_year": "2025-2026",
      "sha256": null,
      "public_access_verified": true
    },
    {
      "canonical_url": "https://catalog.ncf.edu/undergraduate/academic-standing/",
      "publisher": "New College of Florida Academic Catalog",
      "authority_type": "catalog",
      "retrieved_at": "2026-08-31T17:10:00Z",
      "last_modified": null,
      "effective_from": null,
      "effective_through": null,
      "academic_year": "2025-2026",
      "sha256": null,
      "public_access_verified": true
    },
    {
      "canonical_url": "https://catalog.ncf.edu/undergraduate/degree-graduation-requirements/",
      "publisher": "New College of Florida Academic Catalog",
      "authority_type": "catalog",
      "retrieved_at": "2026-08-31T17:10:00Z",
      "last_modified": null,
      "effective_from": null,
      "effective_through": null,
      "academic_year": "2025-2026",
      "sha256": null,
      "public_access_verified": true
    },
    {
      "canonical_url": "https://catalog.ncf.edu/undergraduate/financial-aid-programs/",
      "publisher": "New College of Florida Academic Catalog",
      "authority_type": "catalog",
      "retrieved_at": "2026-08-31T17:10:00Z",
      "last_modified": null,
      "effective_from": null,
      "effective_through": null,
      "academic_year": "2025-2026",
      "sha256": null,
      "public_access_verified": true
    },
    {
      "canonical_url": "https://catalog.ncf.edu/undergraduate/leave-absence/",
      "publisher": "New College of Florida Academic Catalog",
      "authority_type": "catalog",
      "retrieved_at": "2026-08-31T17:10:00Z",
      "last_modified": null,
      "effective_from": null,
      "effective_through": null,
      "academic_year": "2025-2026",
      "sha256": null,
      "public_access_verified": true
    },
    {
      "canonical_url": "https://catalog.ncf.edu/graduate/academic-regulations/",
      "publisher": "New College of Florida Academic Catalog",
      "authority_type": "catalog",
      "retrieved_at": "2026-08-31T17:10:00Z",
      "last_modified": null,
      "effective_from": null,
      "effective_through": null,
      "academic_year": "2025-2026",
      "sha256": null,
      "public_access_verified": true
    },
    {
      "canonical_url": "https://www.ncf.edu/advising/",
      "publisher": "New College of Florida",
      "authority_type": "office",
      "retrieved_at": "2026-08-31T17:10:00Z",
      "last_modified": null,
      "effective_from": null,
      "effective_through": null,
      "academic_year": "2025-2026",
      "sha256": null,
      "public_access_verified": true
    },
    {
      "canonical_url": "https://catalog.ncf.edu/",
      "publisher": "New College of Florida Academic Catalog",
      "authority_type": "catalog",
      "retrieved_at": "2026-08-31T17:10:00Z",
      "last_modified": null,
      "effective_from": null,
      "effective_through": null,
      "academic_year": "2025-2026",
      "sha256": null,
      "public_access_verified": true
    }
  ],
  "status": "current",
  "volatility": "annual",
  "review_after": "2027-06-30",
  "notes": "Public sources use both 'Student Academic Standing Committee' and 'Student Academic Status Committee' for SASC; the resource records the inconsistency without resolving it. Detailed advising guidance is behind MyNCF login and is recorded as a coverage gap. sha256 is null for every source. Each page was located and read at its public URL on 2026-08-31, but the network egress available during collection could not re-download raw response bodies for hashing, so no digest is asserted rather than a fabricated one. Agent 5 owns hashing via tools/fetch_sources.py; digests must be populated by that pipeline (or an equivalent unrestricted re-fetch) before this sidecar can pass a schema that requires 64 hex characters. retrieved_at reflects the collection session on 2026-08-31."
}
